{
  "schemaVersion": 2,
  "genre": "hip-hop",
  "styleId": "hip-hop-west-coast-g-funk-expansion",
  "styleName": "West Coast G-Funk Expansion",
  "durationSec": 109.0909090909092,
  "tempoBpm": 88,
  "meter": "4/4",
  "sections": [
    {
      "id": "r0",
      "key": "intro-0",
      "kind": "intro",
      "label": "Intro",
      "bars": 4,
      "intensity": "low",
      "chords": [
        "Am7",
        "Fmaj7",
        "Cmaj7",
        "G"
      ]
    },
    {
      "id": "r1",
      "key": "verse-1",
      "kind": "verse",
      "label": "Verse",
      "bars": 8,
      "intensity": "medium",
      "chords": [
        "Am7",
        "Fmaj7",
        "Cmaj7",
        "G"
      ]
    },
    {
      "id": "r2",
      "key": "chorus-2",
      "kind": "chorus",
      "label": "Chorus",
      "bars": 8,
      "intensity": "high",
      "chords": [
        "Am7",
        "Fmaj7",
        "Cmaj7",
        "G"
      ]
    },
    {
      "id": "r3",
      "key": "bridge-3",
      "kind": "bridge",
      "label": "Bridge",
      "bars": 8,
      "intensity": "high",
      "chords": [
        "Am7",
        "Fmaj7",
        "Cmaj7",
        "G"
      ]
    },
    {
      "id": "r4",
      "key": "solo-4",
      "kind": "solo",
      "label": "Instrumental",
      "bars": 8,
      "intensity": "peak",
      "chords": [
        "Am7",
        "Fmaj7",
        "Cmaj7",
        "G"
      ]
    },
    {
      "id": "r5",
      "key": "coda-5",
      "kind": "coda",
      "label": "Coda",
      "bars": 4,
      "intensity": "low",
      "chords": [
        "Am7",
        "Fmaj7",
        "Cmaj7",
        "G"
      ]
    }
  ],
  "tracks": [
    {
      "trackId": "v0",
      "instrumentId": "drums",
      "role": "percussion",
      "patternIds": [
        "hiphop-boom-basic",
        "hiphop-neosoul",
        "hiphop-westcoast",
        "hiphop-breakbeat"
      ],
      "noteCount": 223
    },
    {
      "trackId": "v1",
      "instrumentId": "bass",
      "role": "bass",
      "patternIds": [
        "hiphop-808-glide-bass",
        "style-hip-hop-west-coast-g-funk-expansion-signature"
      ],
      "noteCount": 122
    },
    {
      "trackId": "v2",
      "instrumentId": "synth",
      "role": "lead",
      "patternIds": [
        "tech-hip-hop-vinyl-texture",
        "style-hip-hop-west-coast-g-funk-expansion-signature"
      ],
      "noteCount": 64
    },
    {
      "trackId": "v3",
      "instrumentId": "voice",
      "role": "voice",
      "patternIds": [
        "tech-hip-hop-vocal-chop",
        "tech-hip-hop-beat-switch",
        "tech-hip-hop-vinyl-texture"
      ],
      "noteCount": 64
    },
    {
      "trackId": "v4",
      "instrumentId": "sub-bass",
      "role": "bass",
      "patternIds": [
        "style-hip-hop-west-coast-g-funk-expansion-signature",
        "tech-hip-hop-vinyl-texture",
        "hiphop-808-glide-bass"
      ],
      "noteCount": 141
    },
    {
      "trackId": "v5",
      "instrumentId": "piano",
      "role": "harmony",
      "patternIds": [
        "tech-hip-hop-beat-switch",
        "hip-hop-sampled-keys",
        "jazz-piano-comping"
      ],
      "noteCount": 567
    },
    {
      "trackId": "v6",
      "instrumentId": "turntable",
      "role": "lead",
      "patternIds": [
        "hiphop-808-glide-bass",
        "style-hip-hop-west-coast-g-funk-expansion-signature",
        "tech-hip-hop-vinyl-texture"
      ],
      "noteCount": 64
    },
    {
      "trackId": "v7",
      "instrumentId": "warm-pad",
      "role": "harmony",
      "patternIds": [
        "tech-hip-hop-vinyl-texture",
        "hiphop-808-glide-bass"
      ],
      "noteCount": 64
    }
  ],
  "patterns": [
    {
      "id": "hiphop-boom-basic",
      "name": "Boom Bap Basic",
      "worldId": "hip-hop",
      "meter": "4/4",
      "subdivisions": 16,
      "onsetGrid": [
        0,
        4,
        8,
        12,
        10
      ],
      "techniques": []
    },
    {
      "id": "hiphop-neosoul",
      "name": "Neo-Soul Hip Hop",
      "worldId": "hip-hop",
      "meter": "4/4",
      "subdivisions": 16,
      "onsetGrid": [
        0,
        5,
        8,
        13
      ],
      "techniques": []
    },
    {
      "id": "hiphop-westcoast",
      "name": "West Coast",
      "worldId": "hip-hop",
      "meter": "4/4",
      "subdivisions": 16,
      "onsetGrid": [
        0,
        4,
        7,
        12,
        15
      ],
      "techniques": []
    },
    {
      "id": "hiphop-breakbeat",
      "name": "Old School Break",
      "worldId": "hip-hop",
      "meter": "4/4",
      "subdivisions": 16,
      "onsetGrid": [
        0,
        3,
        4,
        7,
        8,
        10,
        12
      ],
      "techniques": []
    },
    {
      "id": "hiphop-808-glide-bass",
      "name": "808 Glide & Sub Slide Bass",
      "worldId": "hip-hop",
      "meter": "4/4",
      "subdivisions": 16,
      "onsetGrid": [
        0,
        6,
        12
      ],
      "techniques": []
    },
    {
      "id": "style-hip-hop-west-coast-g-funk-expansion-signature",
      "name": "West Coast G-Funk Expansion",
      "worldId": "hip-hop",
      "meter": "4/4",
      "subdivisions": 16,
      "onsetGrid": [
        0,
        4,
        8,
        12
      ],
      "techniques": [
        "beat switch",
        "vinyl texture"
      ]
    },
    {
      "id": "tech-hip-hop-vinyl-texture",
      "name": "vinyl texture",
      "worldId": "hip-hop",
      "meter": "4/4",
      "subdivisions": 16,
      "onsetGrid": [
        0,
        4,
        8,
        12
      ],
      "techniques": [
        "vinyl texture"
      ]
    },
    {
      "id": "tech-hip-hop-vocal-chop",
      "name": "vocal chop",
      "worldId": "hip-hop",
      "meter": "4/4",
      "subdivisions": 16,
      "onsetGrid": [
        0,
        4,
        8,
        12
      ],
      "techniques": [
        "vocal chop"
      ]
    },
    {
      "id": "tech-hip-hop-beat-switch",
      "name": "beat switch",
      "worldId": "hip-hop",
      "meter": "4/4",
      "subdivisions": 16,
      "onsetGrid": [
        0,
        4,
        8,
        12
      ],
      "techniques": [
        "beat switch"
      ]
    },
    {
      "id": "hip-hop-sampled-keys",
      "name": "Sampled Keys Loop",
      "worldId": "hip-hop",
      "meter": "4/4",
      "subdivisions": 24,
      "onsetGrid": [
        0,
        6,
        12,
        18,
        10
      ],
      "techniques": []
    },
    {
      "id": "jazz-piano-comping",
      "name": "Syncopated Piano Comping",
      "worldId": "jazz",
      "meter": "4/4",
      "subdivisions": 16,
      "onsetGrid": [
        0,
        6,
        14
      ],
      "techniques": []
    }
  ],
  "sonicFeatures": {
    "characteristicInstruments": [
      "drums",
      "bass",
      "synth",
      "voice"
    ],
    "techniques": [
      "beat switch",
      "vinyl texture"
    ],
    "signatureCell": "Slow funk groove with melodic synth",
    "tempoRange": [
      75,
      100
    ],
    "preferredMeters": [
      "4/4"
    ],
    "microtimingFeel": "straight",
    "swingPercentage": 50,
    "anticipationOffsetSteps": 0
  },
  "references": {
    "artists": [
      "Dr. Dre",
      "Warren G",
      "Snoop Dogg"
    ],
    "tracks": []
  },
  "render": {
    "status": "compiled",
    "renderer": "MixGenres compileWholeSong",
    "sourceStyleId": "hip-hop-west-coast-g-funk-expansion"
  },
  "performance": {
    "noteCount": 1309,
    "trackCount": 8,
    "usedPatternIds": [
      "hiphop-boom-basic",
      "hiphop-neosoul",
      "hiphop-westcoast",
      "hiphop-breakbeat",
      "hiphop-808-glide-bass",
      "style-hip-hop-west-coast-g-funk-expansion-signature",
      "tech-hip-hop-vinyl-texture",
      "tech-hip-hop-vocal-chop",
      "tech-hip-hop-beat-switch",
      "hip-hop-sampled-keys",
      "jazz-piano-comping"
    ]
  }
}
